{
  "schema": "evidence_fold_in_admissibility_v0",
  "authority_status": "diagnostic_non_normative",
  "creates_release_authority": false,
  "invariant": "non_normative_field_points_must_not_enter_recorded_release_evidence_without_mechanical_admissibility",
  "candidates": [
    {
      "candidate_id": "pulse-pd-summary",
      "source_surface_type": "pulse_pd_artifact",
      "source_authority_status": "diagnostic_non_normative",
      "evidence_role": "analysis_evidence",
      "source_artifact": {
        "path": "pulse_pd/artifacts/pd_summary.json",
        "sha256": "bbbbbbbbbbbbbbbbbbbbbbbbbbbbbbbbbbbbbbbbbbbbbbbbbbbbbbbbbbbbbbbb"
      },
      "schema_path": null,
      "schema_valid": false,
      "digest_valid": true,
      "verification_status": "not_applicable",
      "folded_into_status_requested": false,
      "policy_route": null,
      "admissibility": "advisory_only",
      "reason": "Digest-backed diagnostic artifact without schema-valid policy-routed fold-in."
    }
  ],
  "result": "advisory_only",
  "notes": "Advisory diagnostic evidence remains outside recorded release evidence."
}
